{
  "esquema": "punto-control@1",
  "id_pch": "PCH-3",
  "objeto": "cobertura",
  "abierto_en": "2026-09-18T13:40:28Z",
  "contexto_presentado": {
    "artefacto_ref": "etapa-1/afirmaciones/ (52 verificadas, 10 descartadas), etapa-1/inventario-prohibidos.json, etapa-1/contradicciones.json",
    "intentos_consumidos": 2,
    "hallazgos_acumulados": [
      {
        "asunto": "cobertura_deficitaria",
        "codigo": "ERR-901",
        "detalle": "comunicacion_saber queda con 1 afirmacion verificada frente a un minimo de 2. Es la unica dimension deficitaria de las diecisiete.",
        "dimensiones_deficitarias": [
          "comunicacion_saber"
        ]
      },
      {
        "asunto": "afirmaciones_descartadas",
        "codigo": "ERR-704",
        "detalle": "10 afirmaciones agotaron sus dos intentos y se descartaron con registro: AF-0001 (coronacion de Sancho II), AF-0022 (la treta de Bellido Dolfos), AF-0029, AF-0039, AF-0043, AF-0045, AF-0057, AF-0058, AF-0060, AF-0062. Sus identificadores no se reutilizan."
      },
      {
        "asunto": "invariantes_de_sellado_en_conflicto",
        "codigo": "ERR-802",
        "detalle": "contexto-historico@1 exige 3-8 afirmaciones por dimension y un total de 50 como maximo; configuracion@1 con 17 dimensiones fija minimo 2, maximo 4 y tope global 52. El Contexto cumple la configuracion y no el esquema. Sin decision del autor, CMP-009 no puede sellar."
      },
      {
        "asunto": "severidades_sin_fila_declarada",
        "codigo": "ERR-306",
        "detalle": "El modo respaldo de AG-VER-INV es el unico modo de verificador del registro que no declara clave_severidad en sus criterios, asi que TODOS sus hallazgos caen en la regla por defecto y se resuelven como Mayor. Al menos AF-0002 y AF-0029 fueron graduadas Menor por el verificador y elevadas a Mayor por la tabla; con Menor no habrian forzado reescritura."
      },
      {
        "asunto": "tope_global_desbordado_por_particiones",
        "codigo": "ERR-902",
        "detalle": "Los identificadores llegan a AF-0062 sobre un tope_global_afirmaciones de 52. El exceso no procede de investigacion nueva sino de las particiones que exigio el criterio de atomicidad."
      }
    ]
  },
  "opciones": [
    {
      "id": "continuar_con_cobertura_incompleta",
      "enunciado": "Confirmar el Contexto Historico tal como esta y continuar a la Etapa 2.",
      "consecuencia": "Se registra confirmacion_autor en el Contexto, que pasa a Cerrado_incompleta, y la guarda de transicion de etapas.json queda satisfecha. La novela se escribira con una dimension deficitaria (comunicacion_saber, 1 de 2) y sin la coronacion de Sancho II ni la treta de Bellido Dolfos entre las afirmaciones verificadas: el Canon podra usarlas solo bajo Licencia Literaria declarada. Exige ademas aceptar el sellado pese al conflicto ERR-802."
    },
    {
      "id": "repetir_la_etapa",
      "enunciado": "Repetir la Etapa 1 completa con /etapa-repetir.",
      "consecuencia": "Todo lo producido se archiva en archivo/ y NO se borra; la etapa se ejecuta desde cero con un plan nuevo. Cuesta de nuevo las ~31 invocaciones de la etapa y no garantiza mejor cobertura: los descartes vinieron de criterios del verificador, no de falta de esfuerzo."
    },
    {
      "id": "abortar",
      "enunciado": "Abortar el Proyecto.",
      "consecuencia": "El Proyecto pasa a Abortado. Lo producido queda legible y auditable para siempre, pero no admite pasos nuevos."
    }
  ],
  "opcion_elegida": "continuar_con_cobertura_incompleta",
  "motivo": "El autor confirma la cobertura Incompleta y autoriza el sellado pese al conflicto ERR-802 entre las invariantes_al_sellar de contexto-historico@1 y los valores de configuracion@1 para diecisiete dimensiones. Decision tomada con la solicitud completa delante: una dimension deficitaria (comunicacion_saber, 1 de 2), diez afirmaciones descartadas entre ellas AF-0001 y AF-0022, y las anomalias ERR-306 y ERR-902 registradas.",
  "resuelto_en": "2026-09-18T14:46:40Z"
}